{
  "request_id": "rollover-20260705-194906-2deccafb",
  "request_type": "rollover",
  "created_at": "2026-07-05T19:49:06-06:00",
  "source": "owner-cli",
  "status": "processed",
  "payload": {
    "reason": "Functional test for pcc-pathD-008",
    "safe_stop_report": "[OK] State consistency: PCC state validation OK\n[ISSUE] Restart safety (advisor + worker): Drafted advisor restart brief for task 'pcc-pathD-008' at C:\\Users\\farri\\AppData\\Local\\Temp\\pcc-dual-restart-advisor-3a5d652e-f2b7-4957-b171-aa207fe2d264.md Fail: C:\\ProjectControlCockpit\\scripts\\verify-dual-restart-safety.ps1:49 Line | 49 | Fail \"Dual-restart proof FAILED (advisor side): $advisorBriefPath … | ~~~~~~~~~~~~~~~~~~~~~~~~~~~~~~~~~~~~~~~~~~~~~~~~~~~~~~~~~~~~~~~~~ | Dual-restart proof FAILED (advisor side): .cockpit/handoff/advisor-restart-brief.md does not match what | generate-advisor-restart-brief.ps1 currently produces from canonical state (ignoring the generation timestamp). | A fresh advisor session would read stale content.\n[ISSUE] Next action: missing or empty in canonical state. A fresh session would not know what to do next.\n\nPCC Safe-Stop Summary\n(Read-only. Does not advance task status, write a verdict, or gate anything.)\n\nResume by reading:\n  .cockpit/state/project-state.json\n  .cockpit/state/task-state.json\n  .cockpit/handoff/worker-directive.md\n  .cockpit/result/verification-result.json\n  .cockpit/handoff/advisor-restart-brief.md\n\nActive task: pcc-pathD-008 (status: in_progress)\nTask-level next action: \nProject-level next action: Task 'pcc-pathD-008' (rollover/handoff controls, command-to-copy design) is drafted and the pre-task handoff gate is being run before work begins.\n\nSafe to stop: NOT CLEANLY. 2 issue(s) found above - a fresh session may need extra context until these are resolved."
  }
}
